Text,Summary
"The quick brown fox jumps over the lazy dog.","Fox jumps"
"The sun rises in the east and sets in the west.","Sun rises, sets"
"Rainy days can be both calming and melancholic.","Rainy days"
"Mountains are really majestic and inspiring.","Mountains majestic"
"The ocean is vast and full of mysteries.","Ocean vast"
"Birds sing beautifully in the morning.","Birds sing"
"Books are a gateway to different worlds.","Books gateway"
"Music can uplift the spirit and soothe the soul.","Music uplifts"
"Flowers bloom in spring, adding color to the world.","Flowers bloom"
"The night sky is filled with stars and wonders.","Night sky"
"Technology is advancing rapidly, changing the way we live and work every day.","Technology is advancing and changing our life"
"Healthy eating habits can significantly improve your overall well-being and longevity.","Healthy eating habits lead to longevity"
"Traveling to new places broadens your horizons and enriches your experiences.","Travel broadens horizons"
"Exercise regularly to maintain physical fitness and mental health.","Regular exercise helps overall health"
"Reading books can expand your knowledge and stimulate your imagination.","Reading expands knowledge and imagination"
"Spending time in nature can reduce stress and improve your mood.","Nature reduces stress"
"Learning new skills can boost your confidence and open up new opportunities.","Learning new skills"
"Volunteering helps you give back to the community and make a positive impact.","Volunteering helps community"
"Art and creativity can be powerful outlets for self-expression and emotional release.","Art and creativity is a way for self-expression"
"Building strong relationships with family and friends is essential for a fulfilling life.","Strong relationships is essential part of life"
"Artificial intelligence is revolutionizing industries by automating tasks and improving efficiency.","AI revolution"
"Climate change is causing more frequent and severe weather events worldwide.","Climate change impact"
"Renewable energy sources like solar and wind are essential for a sustainable future.","Renewable energy are essential"
"Advancements in medical technology are leading to better diagnosis and treatment of diseases.","Medical advancements lead to better health"
"Online education platforms are making learning accessible to people around the globe.","Online education makes learning accessible"
"Space exploration is expanding our understanding of the universe and our place in it.","Space exploration"
"Social media platforms are changing the way we communicate and share information.","Social media impact"
"Electric vehicles are becoming more popular as a cleaner alternative to traditional cars.","Electric vehicles are popularizing"
"Blockchain technology is being used to create secure and transparent digital transactions.","Blockchain technology is foundation of security"
"Virtual reality is providing immersive experiences in gaming, education, and training.","Virtual reality provides immersive experience"


